{"normalizationVersion":"synthetic-authoring-0.1","records":[{"confidence":1,"derivation":"Authored directly against UnitSpec 0.1.","note":"Original public synthetic fixture; no external source content.","sourceArtifact":"original-synthetic-mosslight-exchange","status":"exact","targetPointer":""}],"schemaVersion":"0.1","sourceSnapshotId":"original-synthetic-mosslight-exchange-0.1","unitId":"mosslight-exchange"}
